{
  "$schema": "./registry-schema.json",
  "version": "1.0.0",
  "lastUpdate": "2026-09-14",
  "totalProfiles": 29,
  "profiles": [
    {
      "id": "rakwireless-rak2461",
      "vendor": "RAKwireless",
      "model": "RAKwireless-RAK2461",
      "version": "1.0.0",
      "path": "profiles/RAKwireless/RAKwireless-RAK2461.yaml",
      "verified": false,
      "hasTests": false,
      "description": "RAKwireless RAKwireless-RAK2461 Sensor",
      "deviceType": "Sensor",
      "lorawanClass": [
        "A"
      ],
      "contentSha256": "944daf09ec67f0b744f93dc9f6a5c8f7ae7552b8f23f01698d65584188dfc9c3",
      "lastUpdate": "2026-05-14"
    },
    {
      "id": "rakwireless-rak7201",
      "vendor": "RAKwireless",
      "model": "RAKwireless-RAK7201",
      "version": "1.0.0",
      "path": "profiles/RAKwireless/RAKwireless-RAK7201.yaml",
      "verified": false,
      "hasTests": false,
      "description": "RAKwireless RAKwireless-RAK7201 Sensor",
      "deviceType": "Sensor",
      "lorawanClass": [
        "A"
      ],
      "contentSha256": "31e381d0eb7ccccbdead1b0098593c7308343389589d4077a221a145e560f5c3",
      "lastUpdate": "2026-04-29"
    },
    {
      "id": "becasmart-bac006",
      "vendor": "Becasmart",
      "model": "Becasmart-BAC006",
      "version": "1.0.0",
      "path": "profiles/Becasmart/Becasmart-BAC006.yaml",
      "verified": false,
      "hasTests": false,
      "description": "Becasmart Becasmart-BAC006 Sensor",
      "deviceType": "Sensor",
      "lorawanClass": [
        "C"
      ],
      "contentSha256": "d3931b9f50e86d61584c07513403ba786abf3e30dc1bd810b15947075c573237",
      "lastUpdate": "2026-04-29"
    },
    {
      "id": "dragino-dds45",
      "vendor": "Dragino",
      "model": "Dragino-DDS45",
      "version": "1.0.0",
      "path": "profiles/Dragino/Dragino-DDS45.yaml",
      "verified": false,
      "hasTests": false,
      "description": "Dragino Dragino-DDS45 Sensor",
      "deviceType": "Sensor",
      "lorawanClass": [
        "A"
      ],
      "contentSha256": "21b896230e8c5381575c17d0715ed680db2399bee71d5150b9a168cf7282091a",
      "lastUpdate": "2026-04-24"
    },
    {
      "id": "dragino-lds02",
      "vendor": "Dragino",
      "model": "Dragino-LDS02",
      "version": "1.0.0",
      "path": "profiles/Dragino/Dragino-LDS02.yaml",
      "verified": false,
      "hasTests": false,
      "description": "Dragino Dragino-LDS02 Sensor",
      "deviceType": "Sensor",
      "lorawanClass": [
        "A"
      ],
      "contentSha256": "5516b3868d00ebc6cea3096928179596b6fa30642a85ec31f07e3d2ae22522e2",
      "lastUpdate": "2026-04-24"
    },
    {
      "id": "dragino-lse01",
      "vendor": "Dragino",
      "model": "Dragino-LSE01",
      "version": "1.0.0",
      "path": "profiles/Dragino/Dragino-LES01.yaml",
      "verified": false,
      "hasTests": false,
      "description": "Dragino Dragino-LSE01 Sensor",
      "deviceType": "Sensor",
      "lorawanClass": [
        "A"
      ],
      "contentSha256": "6a923d6fd57fa53e727d5c318a9862dccfe8623c6814eaa640ff25eb2be1236f",
      "lastUpdate": "2026-04-24"
    },
    {
      "id": "dragino-s31b-lb",
      "vendor": "Dragino",
      "model": "Dragino-S31B-LB",
      "version": "1.0.0",
      "path": "profiles/Dragino/Dragino-S31B-LB.yaml",
      "verified": false,
      "hasTests": false,
      "description": "Dragino Dragino-S31B-LB Sensor",
      "deviceType": "Sensor",
      "lorawanClass": [
        "A"
      ],
      "contentSha256": "e956c36b6c00ea22bd186c754660d8ec59f0fe9819085b444530b85a3eede81e",
      "lastUpdate": "2026-05-08"
    },
    {
      "id": "dragino-se01-lb",
      "vendor": "Dragino",
      "model": "Dragino-SE01-LB",
      "version": "1.0.0",
      "path": "profiles/Dragino/Dragino-SE01-LB.yaml",
      "verified": false,
      "hasTests": false,
      "description": "Dragino Dragino-SE01-LB Sensor",
      "deviceType": "Sensor",
      "lorawanClass": [
        "A"
      ],
      "contentSha256": "52a590f83589085990e6814e08897575da4e4d8e0ec349c6ce3ec806cbcdaddc",
      "lastUpdate": "2026-05-08"
    },
    {
      "id": "dragino-wsc2-l",
      "vendor": "Dragino",
      "model": "Dragino-WSC2-L",
      "version": "1.0.0",
      "path": "profiles/Dragino/Dragino-WSC2-L.yaml",
      "verified": false,
      "hasTests": false,
      "description": "Dragino Dragino-WSC2-L Sensor",
      "deviceType": "Sensor",
      "lorawanClass": [
        "A"
      ],
      "contentSha256": "ec6bd00b66f02bbc08dc5b9f9a929d0622355b89ee95e8bca4a2ce817c853c65",
      "lastUpdate": "2026-04-24"
    },
    {
      "id": "eddy-solutions-h20-v3",
      "vendor": "Eddy-Solutions",
      "model": "Eddy-Solutions-H20-V3",
      "version": "3.0.0",
      "path": "profiles/Eddy-Solutions/Eddy-Solutions-H20-V3.yaml",
      "verified": false,
      "hasTests": true,
      "description": "Eddy-Solutions Eddy-Solutions-H20-V3 Sensor",
      "deviceType": "Sensor",
      "lorawanClass": [
        "C"
      ],
      "contentSha256": "1459359acd021ba0cea89306c932dd77fbdaddd08cdd1d1437eb743bcb83bc66",
      "lastUpdate": "2026-09-14"
    },
    {
      "id": "eddy-solutions-link",
      "vendor": "Eddy-Solutions",
      "model": "Eddy-Solutions-Link",
      "version": "1.0.0",
      "path": "profiles/Eddy-Solutions/Eddy-Solutions-Link.yaml",
      "verified": false,
      "hasTests": true,
      "description": "Eddy-Solutions Eddy-Solutions-Link Sensor",
      "deviceType": "Sensor",
      "lorawanClass": [
        "C"
      ],
      "contentSha256": "63240ba3d632dcad40a9809d613af9aee70161612c7a8d90134e97e2a19f6ef6",
      "lastUpdate": "2026-09-14"
    },
    {
      "id": "eddy-solutions-lora-iq-v2",
      "vendor": "Eddy-Solutions",
      "model": "Eddy-Solutions-LoRa-IQ-V2",
      "version": "1.0.0",
      "path": "profiles/Eddy-Solutions/Eddy-Solutions-LoRa-IQ-V2.yaml",
      "verified": false,
      "hasTests": true,
      "description": "Eddy Solutions LoRa IQ V2 smart water flow meter and shutoff valve",
      "deviceType": "Water Flow Meter",
      "lorawanClass": [
        "C"
      ],
      "contentSha256": "bdabc13c389aff861c446d1995163c906831b4141a978d373f4a4b9c86633024",
      "lastUpdate": "2026-08-12"
    },
    {
      "id": "kaiterra-se-300",
      "vendor": "Kaiterra",
      "model": "Kaiterra-SE-300",
      "version": "1.0.0",
      "path": "profiles/Kaiterra/Kaiterra-SE300.yaml",
      "verified": false,
      "hasTests": false,
      "description": "Kaiterra Kaiterra-SE-300 CO2 Sensor",
      "deviceType": "CO2 Sensor",
      "lorawanClass": [
        "C"
      ],
      "contentSha256": "31a47ef20e68821c1be5d58d6be824ac0409b146f1386299eb7d8b8c163f2297",
      "lastUpdate": "2026-07-23"
    },
    {
      "id": "milesight-em410-rdl",
      "vendor": "Milesight",
      "model": "Milesight-EM410-RDL",
      "version": "1.0.0",
      "path": "profiles/Milesight/Milesight-EM410-RDL.yaml",
      "verified": false,
      "hasTests": true,
      "description": "Milesight Milesight-EM410-RDL Sensor",
      "deviceType": "Sensor",
      "lorawanClass": [
        "A"
      ],
      "contentSha256": "4ff48f916bd29d07fbb6e47928c573adcef131dd79ae1ba5ea9e28e6327da328",
      "lastUpdate": "2026-08-06"
    },
    {
      "id": "milesight-uc300",
      "vendor": "Milesight",
      "model": "Milesight-UC300",
      "version": "1.0.0",
      "path": "profiles/Milesight/Milesight-UC300.yaml",
      "verified": false,
      "hasTests": false,
      "description": "Milesight Milesight-UC300 Sensor",
      "deviceType": "Sensor",
      "lorawanClass": [
        "A"
      ],
      "contentSha256": "88a18146b865a79c178a249195944d3940b615828d1a60f55c30a76c2fcdb810",
      "lastUpdate": "2025-12-12"
    },
    {
      "id": "milesight-vs330",
      "vendor": "Milesight",
      "model": "Milesight-VS330",
      "version": "1.0.0",
      "path": "profiles/Milesight/Milesight-VS330.yaml",
      "verified": false,
      "hasTests": false,
      "description": "Milesight Milesight-VS330 Sensor",
      "deviceType": "Sensor",
      "lorawanClass": [
        "A"
      ],
      "contentSha256": "203a38a53e7763c900b24e203732bb26f43993ba71ce963f03b89020c2e0e999",
      "lastUpdate": "2026-04-24"
    },
    {
      "id": "milesight-wt304",
      "vendor": "Milesight",
      "model": "Milesight-WT304",
      "version": "1.0.0",
      "path": "profiles/Milesight/Milesight-WT304.yaml",
      "verified": false,
      "hasTests": true,
      "description": "Milesight Milesight-WT304 Sensor",
      "deviceType": "Sensor",
      "lorawanClass": [
        "C"
      ],
      "contentSha256": "09dcf071957ce43e5fce6bd43cc9f9b003f153e82c61c80c9bf33eefb88bd43a",
      "lastUpdate": "2026-08-06"
    },
    {
      "id": "moko-lw013sb",
      "vendor": "Moko",
      "model": "Moko-LW013SB",
      "version": "1.0.0",
      "path": "profiles/Moko/Moko-LW013SB.yaml",
      "verified": false,
      "hasTests": false,
      "description": "LW013-SB Smart Button with multiple event types",
      "deviceType": "Sensor",
      "lorawanClass": [
        "A"
      ],
      "contentSha256": "6c25300e8851d85d9f5ff8980bcc7772e63ec65b804725f22dbebe01d97a7484",
      "lastUpdate": "2026-07-07"
    },
    {
      "id": "qingping-cgp22clh",
      "vendor": "QingPing",
      "model": "QingPing-CGP22CLH",
      "version": "1.0.0",
      "path": "profiles/QingPing/QingPing-CGP22CLH.yaml",
      "verified": false,
      "hasTests": true,
      "description": "QingPing CGP22CLH Indoor CO2/Temperature/Humidity Monitor",
      "deviceType": "CO2 Sensor",
      "lorawanClass": [
        "A"
      ],
      "contentSha256": "a6cb62646aa3bdc9ffcce0fbe6d6692a623c424bb57bf22c614c7260b38f18e3",
      "lastUpdate": "2026-08-06"
    },
    {
      "id": "senso8-lrs10701",
      "vendor": "Senso8",
      "model": "Senso8-LRS10701",
      "version": "1.0.0",
      "path": "profiles/Senso8/Senso8-LRS10701.yaml",
      "verified": false,
      "hasTests": false,